{"canonical_parent_sha":"959fe3f853f9de68ed06af16c240ec9be700f88c","changed_paths":["src/helios_takeoff_core/engine/v2/__init__.py","src/helios_takeoff_core/engine/v2/compiler.py","src/helios_takeoff_core/engine/v2/contracts.py","src/helios_takeoff_core/engine/v2/evaluator.py","src/helios_takeoff_core/engine/v2/formulas.py","src/helios_takeoff_core/engine/v2/schemas/domain-pack-v2.schema.json","src/helios_takeoff_core/engine/v2/schemas/observation-bundle-v1.schema.json","src/helios_takeoff_core/engine/v2/store.py","tests/fixtures/engine_v2/airside_equipment_bundle.json","tests/fixtures/engine_v2/full_division23_calculation_pack.json","tests/fixtures/engine_v2/piping_bundle.json","tests/test_engine_v2_calculation_assembly.py","tests/test_engine_v2_registry_spine.py","tests/test_package_metadata.py"],"command_receipt_sha256s":["fb69f284c463b23ee79c37e7cc4f2ddf714a6885e8eb13023571241132ad8a9f","cc5b39abe09d73b24c6041f0263640a237afe219bc9c9a1a6a336d7e38a6c56c"],"handoff_sha256":"798ecb677f210937228625b6199104355ce38f773bc18ae2ab5650e2e0842e88","integrated_commit_sha":"0da163c216b0c2eda9ca251043ad38cf7d3faeb5","integrator_profile_id":"codex-control-v1","protocol":"helios.build.integration-receipt/v1","recorded_at":"2026-09-01T19:29:07.493741Z","review_receipt_sha256":"be881ee013861d62d6df79d648b82700eebb5bb3ee99e9e1126b86c6dcfc0519","task_manifest_sha256":"d7818473288fea00e14aa44c99d6b05077375edf317c7e772e093028804c9117"}