{"canonical_parent_sha":"3e40774e36682391aca6fc3e458111053a93d5a6","changed_paths":["build_control/schemas/athena-worker-profile-v1.schema.json","build_control/schemas/builder-source-bundle-v1.schema.json","build_control/schemas/notebook-manifest-v1.schema.json","build_control/schemas/research-request-v1.schema.json","build_control/schemas/source-packet-v1.schema.json","build_control/schemas/source-record-v1.schema.json","build_control/source_registry/README.md","build_control/source_registry/notebooks.v1.json","build_control/worker_profiles/athena.instructions.v1.md","build_control/worker_profiles/athena.v1.json","tests/test_build_distribution_boundary.py","tests/test_build_research_packets.py","tests/test_build_research_task_input.py","tools/helios_build/cli.py","tools/helios_build/research.py","tools/helios_build/source_registry.py"],"command_receipt_sha256s":["681912e075065619ad8e93e1be18ae2d6b658ba254466f62701cd770dc3d5bfb","75b40841f13862fbc88efb997564f8bd31f4293727b17d018f1cf96145bd5709"],"handoff_sha256":"25b9ecac1dafa2bb930146af684a65b742cc2d18620221cd33661b674cd5307c","integrated_commit_sha":"bffd15c439766d8e92abbe48194e8619d18e3b86","integrator_profile_id":"codex-control-v1","protocol":"helios.build.integration-receipt/v1","recorded_at":"2026-09-01T18:51:57.637197Z","review_receipt_sha256":"95d420fff6520b192590ed1f2347da9f7aa2ac4a2f3655b8fbb513d186c429fb","task_manifest_sha256":"7607569e69e36895aabb4ed87996dfd0701e6745dac1818d4f88e5887f96cf8f"}