{"canonical_parent_sha":"ab84f4f4aee1e0be0e767de4b1202417a780d35f","changed_paths":["pyproject.toml","src/helios_takeoff_core/engine/v2/__init__.py","src/helios_takeoff_core/engine/v2/compiler.py","src/helios_takeoff_core/engine/v2/contracts.py","src/helios_takeoff_core/engine/v2/migrations/001_engine_registry.sql","src/helios_takeoff_core/engine/v2/schemas/domain-pack-v2.schema.json","src/helios_takeoff_core/engine/v2/store.py","tests/fixtures/engine_v2/full_division23_registry_pack.json","tests/test_engine_v2_registry_spine.py","tests/test_package_metadata.py"],"command_receipt_sha256s":["b895ad5261acd60aa32ae56d81d1c10e7030a5f6ea1fbebae3ba4c21b24ac539","f7719540a8854b9ac06f1dc9ff96ebab94f87657e1eb707de3df8d6ec5f61d90"],"handoff_sha256":"2db0600c02a64f913b064569a98f98b357cc208bbe3ee6ff352dfe0714edb3f5","integrated_commit_sha":"d3f980dd5ad0e5a2e1a32a127b34d01bf29efa86","integrator_profile_id":"codex-control-v1","protocol":"helios.build.integration-receipt/v1","recorded_at":"2026-09-01T18:26:27.080275Z","review_receipt_sha256":"9229fe973a4e37ea8d2c2f854ef1f0f699002ac04d736caf1dc44a05ee7c2c25","task_manifest_sha256":"4d86abcf67e37d724b8def4ac1e4682f7d90a131a75fd3ff9997ab7161e90835"}