{"canonical_parent_sha":"5fc323c1857b512b164003a170ffe0f19ce065de","changed_paths":["build_control/README.md","tests/test_build_authority_boundary.py","tests/test_build_cli.py","tests/test_build_dispatch.py","tests/test_build_graph.py","tests/test_build_package_boundary.py","tools/helios_build/__main__.py","tools/helios_build/cli.py"],"command_receipt_sha256s":["578b9f1422e9c9fae5b3db99e496487f8172924d9896f6b3556d84bce20077a4","fee620df19f915b7756f7eb9453d4a78bcdd27757052b3c8180746b70a82f9c7"],"handoff_sha256":"97ec9011146d1f281575371ab428c7f1e2af5773f7a14efda8cd5eb1b292305d","integrated_commit_sha":"f3ff0f36ea7c05ef61cb224721545bed8f7e1c9b","integrator_profile_id":"codex-control-v1","protocol":"helios.build.integration-receipt/v1","recorded_at":"2026-09-01T17:14:39.786927Z","review_receipt_sha256":"bb54906bfdf4f75f200f86abf67d47bcb29ff504b63f264360b72ff6d99f18fa","task_manifest_sha256":"3993b8d0bfa76bd18b49b0054d868f073e5404cebcfccd60e4c5565ce0a8f0e9"}